{
  "schema_version": 1,
  "model_id": "jstack-no-usb-dual-boot-v1",
  "initial_state": "windows.bootstrap_started",
  "scope": {
    "host_os": [
      "windows_10_x86_64",
      "windows_11_x86_64"
    ],
    "firmware": "uefi",
    "partition_table": "gpt",
    "disk_layout": "single_basic_system_disk",
    "install_mode": "dual_boot",
    "windows_filesystem": "ntfs",
    "jstack_filesystem": "btrfs",
    "boot_partition": "xbootldr",
    "minimum_total_allocation_gib": 64,
    "unsupported": [
      "legacy_bios",
      "mbr",
      "dynamic_disk",
      "storage_spaces",
      "raid_system_disk",
      "replace_disk",
      "ambiguous_multi_disk"
    ]
  },
  "actors": [
    "windows_bootstrap",
    "firmware",
    "linux_installer",
    "windows_finalizer",
    "jstack_first_boot",
    "recovery_controller"
  ],
  "actor_platforms": {
    "windows_bootstrap": [
      "windows",
      "shared"
    ],
    "firmware": [
      "firmware",
      "shared"
    ],
    "linux_installer": [
      "linux",
      "shared"
    ],
    "windows_finalizer": [
      "windows",
      "shared"
    ],
    "jstack_first_boot": [
      "jstack",
      "linux",
      "shared"
    ],
    "recovery_controller": [
      "windows",
      "linux",
      "recovery",
      "shared"
    ]
  },
  "guards": [
    {
      "id": "running_as_admin",
      "description": "Windows process has an elevated administrator token.",
      "platform": "windows"
    },
    {
      "id": "supported_windows",
      "description": "Windows 10 or 11 x86-64 is running.",
      "platform": "windows"
    },
    {
      "id": "uefi_boot",
      "description": "Windows booted in UEFI mode and runtime variables are writable.",
      "platform": "windows"
    },
    {
      "id": "gpt_basic_disk",
      "description": "The system disk is GPT and not dynamic, pooled, or RAID-backed.",
      "platform": "windows"
    },
    {
      "id": "single_system_disk",
      "description": "Windows, its ESP, and the target free interval resolve to one unambiguous disk.",
      "platform": "windows"
    },
    {
      "id": "windows_ntfs_supported",
      "description": "The Windows system volume is NTFS and reports a supported shrink range.",
      "platform": "windows"
    },
    {
      "id": "windows_recovery_preserved",
      "description": "The plan leaves Windows MSR and recovery partitions unchanged.",
      "platform": "shared"
    },
    {
      "id": "power_safe",
      "description": "AC is connected or battery policy allows a reboot-spanning install.",
      "platform": "windows"
    },
    {
      "id": "windows_servicing_idle",
      "description": "No pending Windows servicing restart, feature update, storage repair, or other reboot owner can compete with installer handoffs.",
      "platform": "windows"
    },
    {
      "id": "storage_health_acceptable",
      "description": "The system disk and NTFS volume report no dirty state, repair requirement, or failing health condition.",
      "platform": "windows"
    },
    {
      "id": "enough_shrinkable_space",
      "description": "Supported NTFS shrink space covers XBOOTLDR, root minimum, and safety margin.",
      "platform": "windows"
    },
    {
      "id": "esp_has_loader_space",
      "description": "The existing ESP has enough space for the namespaced signed loader.",
      "platform": "windows"
    },
    {
      "id": "boot_chain_trusted",
      "description": "Secure Boot is off or every loader and UKI signature chains to accepted trust.",
      "platform": "shared"
    },
    {
      "id": "installer_rearm_not_attempted",
      "description": "The signed journal proves that no installer BootNext rearm has already been attempted.",
      "platform": "windows"
    },
    {
      "id": "jstack_rearm_not_attempted",
      "description": "The signed journal proves no installed-JStack BootNext rearm has already been attempted.",
      "platform": "windows"
    },
    {
      "id": "jstack_rearm_exhausted",
      "description": "The signed journal proves the single installed-JStack BootNext rearm was already attempted.",
      "platform": "windows"
    },
    {
      "id": "installer_rearm_exhausted",
      "description": "The signed journal proves that the single permitted installer BootNext rearm was already attempted.",
      "platform": "windows"
    },
    {
      "id": "release_candidate_valid",
      "description": "Canonical metadata, immutable local policy, signature quorum, compatibility bindings, and release lifetime validate before durable acceptance.",
      "platform": "shared"
    },
    {
      "id": "release_manifest_valid",
      "description": "Canonical Ed25519 quorum, immutable local policy, channel, architecture, graph digest, protocol, lifetime, and durable anti-rollback acceptance validate.",
      "platform": "shared"
    },
    {
      "id": "staging_evidence_current",
      "description": "Durable evidence binds the accepted manifest, acceptance-state hash, and exact promoted artifact set.",
      "platform": "shared"
    },
    {
      "id": "payload_hashes_valid",
      "description": "The exact byte stream currently being consumed matches every signed chunk hash, whole hash, size, and EOF.",
      "platform": "shared"
    },
    {
      "id": "plan_fingerprint_current",
      "description": "Current disk GUIDs, offsets, sizes, and types match the planned fingerprint.",
      "platform": "shared"
    },
    {
      "id": "confirmed_plan_current",
      "description": "The current plan hash exactly matches the user-confirmed plan hash.",
      "platform": "shared"
    },
    {
      "id": "bitlocker_enabled",
      "description": "BitLocker protection is enabled on the Windows system volume.",
      "platform": "windows"
    },
    {
      "id": "bitlocker_disabled",
      "description": "BitLocker protection is disabled or not applicable.",
      "platform": "windows"
    },
    {
      "id": "bitlocker_recovery_key_confirmed",
      "description": "The user confirmed access to valid BitLocker recovery material.",
      "platform": "windows"
    },
    {
      "id": "finalizer_not_armed",
      "description": "The registered Windows finalizer has no signed Linux completion token and must dispatch bootstrap recovery instead.",
      "platform": "windows"
    },
    {
      "id": "finalizer_registered",
      "description": "A signed Windows finalizer is registered before cross-OS reboot.",
      "platform": "shared"
    },
    {
      "id": "planned_interval_current",
      "description": "All proposed writes remain inside the confirmed unallocated interval.",
      "platform": "shared"
    },
    {
      "id": "xbootldr_partition_matches_plan",
      "description": "The XBOOTLDR GUID, type, offset, and size match the plan before formatting.",
      "platform": "shared"
    },
    {
      "id": "xbootldr_matches_plan",
      "description": "The XBOOTLDR GUID, type, offset, size, and filesystem match the plan.",
      "platform": "shared"
    },
    {
      "id": "handoff_signature_valid",
      "description": "The cross-OS handoff, journal sequence, accepted manifest, and durable staging-evidence hash validate.",
      "platform": "linux"
    },
    {
      "id": "windows_boot_entry_present",
      "description": "The original Windows boot entry and namespaced ESP files remain intact.",
      "platform": "shared"
    },
    {
      "id": "installed_system_valid",
      "description": "Root image, fstab, users, network, Niri, boot artifacts, and recovery units validate.",
      "platform": "linux"
    },
    {
      "id": "bitlocker_restored_or_not_applicable",
      "description": "BitLocker protection is active again or was never enabled.",
      "platform": "shared"
    },
    {
      "id": "jstack_boot_entry_valid",
      "description": "The signed JStack boot entry resolves to the installed release.",
      "platform": "shared"
    },
    {
      "id": "installer_boot_evidence_current",
      "description": "Content-addressed handoff, journal, and installer guest-output witnesses prove the installer boot and agree on graph, release, acceptance, staging, plan, and disk identity.",
      "platform": "shared",
      "evidence": {
        "claim": "installer_boot_observed",
        "content_address": "sha256",
        "identity_fields": [
          "graph_digest",
          "release_digest",
          "release_acceptance_digest",
          "staging_evidence_digest",
          "plan_digest",
          "disk_identity"
        ],
        "witness_roles": [
          "handoff",
          "journal",
          "guest-output"
        ]
      }
    },
    {
      "id": "windows_finalizer_boot_evidence_current",
      "description": "Content-addressed handoff, journal, and Windows boot-attestation witnesses prove the finalizer boot and agree on graph, release, acceptance, staging, plan, and disk identity.",
      "platform": "shared",
      "evidence": {
        "claim": "windows_finalizer_booted",
        "content_address": "sha256",
        "identity_fields": [
          "graph_digest",
          "release_digest",
          "release_acceptance_digest",
          "staging_evidence_digest",
          "plan_digest",
          "disk_identity"
        ],
        "witness_roles": [
          "handoff",
          "journal",
          "windows-boot-attestation"
        ]
      }
    },
    {
      "id": "jstack_boot_evidence_current",
      "description": "Content-addressed handoff, journal, and JStack boot-attestation witnesses prove the installed-system boot and agree on graph, release, acceptance, staging, plan, and disk identity.",
      "platform": "shared",
      "evidence": {
        "claim": "jstack_boot_observed",
        "content_address": "sha256",
        "identity_fields": [
          "graph_digest",
          "release_digest",
          "release_acceptance_digest",
          "staging_evidence_digest",
          "plan_digest",
          "disk_identity"
        ],